{"attempt_id":"attempt-p0-001","immediately_following_status":"immediately_following","join_id":"join-p0-001","join_sha256":"c3d7bc1a789febe7d461d592294cb7753a74858dc32e0f2b689c6feda352bfe6","joining_status":"attributed","observation_receipt_id":"observe-p0-001","observation_receipt_sha256":"eb5053883a32845f530d5313d33bf9340eb679f19b6950d6e206ded2e5532c1e","provider_cost_status":"available","provider_turn_id":"turn-p0-001","provider_usage_status":"available","schema_version":"v1","session_id":"session-p0-001","tool_use_id":"tooluse-p0-001"}
