{"attempt_id":"attempt-p0-001","immediately_following_status":"missing","join_id":"join-p0-002","join_sha256":"c8a3a99dbba5ddfe2716f988e0ec4e1dec20706c1b3478bd430e6584d6dc9274","joining_status":"missing","observation_receipt_id":"observe-p0-002","observation_receipt_sha256":"e4f0cf5d7ec3ae52c771dcd0ad3ccaffa63bd010ae10435ee67171df18f503b7","provider_cost_status":"missing","provider_turn_id":null,"provider_usage_status":"missing","schema_version":"v1","session_id":"session-p0-001","tool_use_id":"tooluse-p0-002"}
